Etisalat Egypt,Etisalat Egypt,Cold,,12000,telecommunications,assemihab26@gmail.com,http://www.etisalat.eg,http://www.linkedin.com/company/etisalat-egypt,,,Cairo,Cairo Governorate,Egypt,,,'+20 111 123 4333,"Facebook Widget, Facebook Custom Audiences, Mobile Friendly, Google Tag Manager, Google Analytics, Google Font API, Google Play, Oracle Webcenter, Facebook Login (Connect), Google Maps (Non Paid Users), Bootstrap Framework, Google Maps, iTunes, Remote",,,,,116900000,,6644a03c9c7e600001ee96ea,,"Building on 15 years of technology excellence in the Egyptian market, and in our relentless quest to bring you more and better services, etisalat by e& in Egypt has now evolved into the digital telco of the future.
 
Covering and serving 99% of the inhabited areas in Egypt, our mission as etisalat by e& in Egypt is to continuously grow and transform to empower our customers by enhancing their digital experience and ensuring operation agility.
 
etisalat by e& in Egypt offers digital experiences that cater to your ever-changing lifestyle and ever-expanding demands – covering not only telecom, but a wide collection of services that suit your various needs. We will continue to be your trusted companion and consultant, enabling connectivity and everything beyond, accelerating the digital world and pioneering future-forward spaces.
 
Together, as we embark on this new era of etisalat by e& in Egypt, we make possible countless connections across continents and create the limitless possibilities of tomorrow, today.
 
etisalat by e& in Egypt #MakePossible

بعد ١٥ سنة من تفوقنا التكنولوجي في مصر، ولإننا حابين نقدم خدمات كتيرة عالية الجودة لكل عملائنا، جه الوقت إللي نطور في ""اتصالات من &e في مصر"" وندخل المستقبل الرقمي من أوسع الأبواب! شبكتنا النهاردة بتغطي ۹۹% من مناطق مصر، وبنطور يوم ورا يوم عشان نوصل رسالتنا بالنمو والتحول والتفوق، كل دا عشان نوفر لعملائنا أفضل تجربة رقمية، ونسرع العملية التشغيلية. النهاردة في ""اتصالات من &e في مصر"" إحنا جاهزين نقدملكم خدمات رقمية جديدة تسهلكو حياتكم اليومية، ومع خدمة المكالمات التقليدية، حنوفرلكم خدمات تانية كتير! لإننا بجد شريكم الموثوق، إللي بيخليكم على تواصل، وبياخدكم للمستقبل عبر تسريع الاقتصاد الرقمي والريادة.
مع ""اتصالات من &e في مصر"" حنبدأ مع بعض عصر جديد، ونقربكم من بعض عبر القارات، ومع بعض حنكتشف إمكانيات بكرة اللامحدودة من النهاردة.
""اتصالات من &e في مصر"" ... معانا 
#makepossible",2007,https://zenprospect-production.s3.amazonaws.com/uploads/pictures/66433bb2a0e8a90001d48265/picture
CIB Egypt,CIB Egypt,Cold,,13000,banking,assemihab26@gmail.com,http://www.cibeg.com,http://www.linkedin.com/company/cibegypt,https://facebook.com/CIBEgypt,,,Giza Governorate,Egypt,,"banking, commercial banking, direct investment, consumer lending, transaction services, cash management, investment banking, capital markets, brokerage & asset management, wealth management",'+20 2 37472000,"Microsoft Office 365, Amazon AWS, Linkedin Marketing Solutions, Facebook Widget, Adobe Media Optimizer, Google AdWords Conversion, Olark, Google Maps, Google Tag Manager, Google Analytics, Incapsula, DoubleClick Conversion, Mobile Friendly, ShareThis, Facebook Login (Connect), Facebook Custom Audiences, Google AdSense, OpenSSL, Google Font API, Vimeo, DoubleClick, Multilingual, Google Play, reCAPTCHA, AngularJS, Yahoo Analytics, CrazyEgg, Hotjar, Apache, Yahoo Ad Manager Plus, Google Dynamic Remarketing, ASP.NET, Ruxit, SiteCore, JQuery 1.11.1, Data Analytics, Remote",400000000,Debt Financing,150000000,11/1/2023,1709659000,,6644a03c9c7e600001ee96f8,6199,"Commercial International Bank was established in 1975 as a joint venture between the National Bank of Egypt (NBE, 51%) and the Chase Manhattan Bank (49%) under the name ""Chase National Bank of Egypt"". Following Chase's decision to divest its equity stake in 1987, NBE increased its shareholding to 99.9%, changing the Bank's name to Commercial International Bank (Egypt) S.A.E. NBE's stake gradually decreased through several public offerings till reaching 18.7%. In 2006, a Consortium led by Ripplewood Holdings acquired NBE stake. In July 2009, Actis, a leading emerging markets private equity firm, invested US$ 244 million to get shares in CIB, acquiring hence 50% of the Ripplewood Holdings Consortium's stake. Five months later, Ripplewood sold its remaining 4.7% stake over the open market, marking the successful transition of strategic partnership to be with Actis, who then became CIB's largest shareholder with a 9.1% stake. In March 2014,Actis sold a portion of its holding, representing 2.6% of the Bank's total outstanding shares, in the open market to a group of international investors. In May 2014, Actis, successfully realised its investment in CIB and sold its remaining 6.5% to Subsidiaries wholly owned by Fairfax Financial Holdings Ltd ""Fairfax"".
CIB is Egypt's leading private sector bank, offering a broad range of financial products and services to its customers, including enterprises of all sizes, institutions, households and high-net worth individuals. CIB strives to provide superior financial solutions to meet all customers' needs. Having the strongest brand equity rightfully places CIB as the bank of choice for over 500 of Egypt's largest corporations. CIB shows tremendous potential within the bourgeoning Retail and SME Banking markets. Through its superior management, high-operating standards, corporate governance best practices and training programs,CIB has succeeded in becoming the most profitable commercial bank operating in Egypt for more than 40 years.",1975,https://zenprospect-production.s3.amazonaws.com/uploads/pictures/663ef7833222cc00013b94f4/picture
Orange Egypt,Orange Egypt,Cold,,152000,telecommunications,assemihab26@gmail.com,http://www.orange.eg,http://www.linkedin.com/company/orange-egypt,https://facebook.com/OrangeEgyptOfficial,https://twitter.com/orange_egypt,Giza,Giza Governorate,Egypt,,"telecom, telecommunications, egypt, mobile operators, crm, 4g, 3g, gsm, edge, gprs",,"CSC Corporate Domains, Outlook, Microsoft Office 365, Taboola Newsroom, Brightcove, Drupal, Amazon SES, Microsoft Application Insights, Digital Ocean Spaces, Atlassian Cloud, GitHub Hosting, PrestaShop, Facebook Widget, Mobile Friendly, Hotjar, Google Maps, Facebook Login (Connect), Google Tag Manager, CrazyEgg, ASP.NET, Google Font API, iTunes, Facebook Custom Audiences, Criteo, Google Play, Google Analytics, Google Analytics Ecommerce Tracking, YouTube, Bootstrap Framework, WordPress.org, Ruby On Rails, reCAPTCHA, DoubleClick, ClickDimensions, Linkedin Marketing Solutions, Twitter Advertising, Remote, AI",,,,,960000000,,6644a03c9c7e600001ee96ee,,"Orange is one of the world's leading telecommunications operators with sales of 42.5 billion euros in 2021 and 140,000 employees worldwide at 31 December 2021, including 78,000 employees in France. 

The Group has a total customer base of 271 million customers worldwide at 31 December 2021, including 224 million mobile customers and 23 million fixed broadband customers. The Group is present in 26 countries. 

Orange is also a leading provider of global IT and telecommunication services to multinational companies under the brand Orange Business.

Orange Egypt is Gender Equality European & International Standard (GEEIS) certified which reflects our dedication (or commitment) to extremely high ethical, social, and environmental standards, as well as the fact that we provide a working atmosphere that is diverse and welcoming to all of our employees.",1998,https://zenprospect-production.s3.amazonaws.com/uploads/pictures/663e5bf252ce770001f15009/picture
Arab African International Bank,Arab African International Bank,Cold,,3900,banking,assemihab26@gmail.com,http://www.aaib.com,http://www.linkedin.com/company/aaibofficial,https://facebook.com/aaibofficial,https://twitter.com/aaibofficial,Cairo,Cairo Governorate,Egypt,,"retail banking, corporate finance, investment banking, corporate banking, treasury services",'+20 2 26733107,"Outlook, AI",,,,,409457000,,6644a03c9c7e600001ee96fb,"6199, 6411","Every day, we want to make your banking experience even better, for a more fulfilling way of life through Innovation, Agility, and Customer Centricity.

We adopted a multi-pronged strategy that has elevated our performance, shifted us to a digitally agile and a market-leading bank which enabled us to capitalize on our strengths, build in flexible new capabilities, and make far-sighted financial decisions to always provide you with innovative products and financial solutions that will make your banking experience much easier and more convenient—always with you at the forefront.

Our main culture pillar is to continuously support our employees to develop and grow, and yet, we instilled Innovation, Agility, and Customer Centricity tactics as integral elements of our culture to be able to offer you an exceptional banking experience.",1964,https://zenprospect-production.s3.amazonaws.com/uploads/pictures/663f336cebc0350001a13a29/picture
